{
  "$schema": "https://json-schema.org/draft/2020-12/schema",
  "title": "AI Coding Toolkit System Dataflow",
  "description": "sys-dataflow is shorthand for system dataflow. This JSON models the high-level flow of information through a feature or system: its inputs and outputs, external dependencies, persistent state, static data, consequential processing, and directed transfers between them. It can represent proposed or implemented behavior, with diff hunks providing evidence in code-review files.",
  "type": "object",
  "additionalProperties": false,
  "required": [
    "schemaVersion",
    "stage",
    "feature",
    "subgraphs"
  ],
  "properties": {
    "schemaVersion": {
      "description": "Version of the System Dataflow schema used by this document.",
      "const": 4
    },
    "stage": {
      "description": "The context represented by the dataflow: proposed behavior during high-level design, implemented behavior in the current codebase, or implemented behavior during code review.",
      "enum": [
        "high-level-design",
        "inspect-code",
        "code-review"
      ]
    },
    "feature": {
      "description": "Name of the feature whose behavior the dataflow explains.",
      "type": "string",
      "minLength": 1
    },
    "diffHunks": {
      "description": "Unified diff hunks that provide implementation evidence for nodes and relationships in a code-review dataflow.",
      "type": "array",
      "items": {
        "$ref": "#/$defs/diffHunk"
      }
    },
    "subgraphs": {
      "description": "Explicit subgraphs, each owning its nodes and relationships. Subgraphs with the same journeySequenceId share a horizontal row; different sequence IDs form vertical phases in ascending order. Membership is defined by containment, not node names or connectivity.",
      "type": "array",
      "minItems": 1,
      "items": {
        "$ref": "#/$defs/subgraph"
      }
    }
  },
  "allOf": [
    {
      "if": {
        "properties": {
          "stage": {
            "const": "code-review"
          }
        },
        "required": [
          "stage"
        ]
      },
      "then": {
        "required": [
          "diffHunks"
        ]
      },
      "else": {
        "not": {
          "required": [
            "diffHunks"
          ]
        },
        "properties": {
          "subgraphs": {
            "type": "array",
            "items": {
              "type": "object",
              "properties": {
                "nodes": {
                  "type": "array",
                  "items": {
                    "type": "object",
                    "not": {
                      "required": [
                        "diffHunkIds"
                      ]
                    }
                  }
                },
                "relationships": {
                  "type": "array",
                  "items": {
                    "type": "object",
                    "not": {
                      "required": [
                        "diffHunkIds"
                      ]
                    }
                  }
                }
              }
            }
          }
        }
      }
    }
  ],
  "$defs": {
    "subgraph": {
      "description": "One named flow. All relationship endpoints must belong to this subgraph; node names and relationship IDs remain unique across the document.",
      "type": "object",
      "additionalProperties": false,
      "required": [
        "id",
        "name",
        "journeySequenceId",
        "nodes",
        "relationships"
      ],
      "properties": {
        "id": {
          "description": "Unique identifier for the subgraph within the document.",
          "type": "string",
          "minLength": 1
        },
        "name": {
          "description": "Display title describing the journey or user flow.",
          "type": "string",
          "minLength": 1
        },
        "journeySequenceId": {
          "description": "Positive sequence number of this phase in the user journey. All nodes in this subgraph must have the same journeySequenceId. Subgraphs with the same number belong to the same phase.",
          "type": "integer",
          "minimum": 1
        },
        "nodes": {
          "description": "User inputs and outputs, external dependencies, system inputs and outputs, persistent state, static data, and critical data processing in the dataflow.",
          "type": "array",
          "minItems": 1,
          "items": {
            "$ref": "#/$defs/node"
          }
        },
        "relationships": {
          "description": "Directed data flows connecting the nodes.",
          "type": "array",
          "items": {
            "$ref": "#/$defs/relationship"
          }
        }
      }
    },
    "diffHunk": {
      "description": "One exact unified diff hunk from the comparison represented by a code-review dataflow.",
      "type": "object",
      "additionalProperties": false,
      "required": [
        "id",
        "file",
        "patch"
      ],
      "properties": {
        "id": {
          "description": "Unique identifier referenced by nodes and relationships in this document.",
          "type": "string",
          "minLength": 1
        },
        "file": {
          "description": "Repository-relative path of the file containing the hunk.",
          "type": "string",
          "minLength": 1
        },
        "patch": {
          "description": "Exact unified diff hunk, including its @@ header.",
          "type": "string",
          "pattern": "^@@"
        }
      }
    },
    "node": {
      "description": "A high-level component in the dataflow. Its type determines whether relationships may enter it, leave it, or both.",
      "type": "object",
      "additionalProperties": false,
      "required": [
        "type",
        "name",
        "journeySequenceId",
        "description",
        "medium",
        "location"
      ],
      "properties": {
        "type": {
          "description": "The node's semantic role in the system dataflow.",
          "oneOf": [
            {
              "description": "Data or an action supplied by a user through a user interface. Dataflow relationships may leave this node but may not enter it.",
              "const": "user-input"
            },
            {
              "description": "Information presented to a user through a user interface. Dataflow relationships may enter this node but may not leave it. Represent a UI component separately as user input and user output when it serves both roles.",
              "const": "user-output"
            },
            {
              "description": "A service, datastore, or other system outside the modeled system boundary that receives requests or data and supplies responses or data. Dataflow relationships may enter and leave this node.",
              "const": "external-dependency"
            },
            {
              "description": "Data sent into the modeled feature or system by an external system. Dataflow relationships may leave this node but may not enter it.",
              "const": "system-input"
            },
            {
              "description": "A final output sent by the modeled feature or system to an external system. Dataflow relationships may enter this node but may not leave it.",
              "const": "system-output"
            },
            {
              "description": "Persistent state read by the dataflow, including instance, static, or global variables and browser, file, external database, or external object storage. Dataflow relationships may leave this node but may not enter it. Represent reads and writes of the same state as separate nodes with the same location.",
              "const": "system-state-read"
            },
            {
              "description": "Persistent state updated by the dataflow, including instance, static, or global variables and browser, file, external database, or external object storage. Dataflow relationships may enter this node but may not leave it. Represent reads and writes of the same state as separate nodes with the same location.",
              "const": "system-state-write"
            },
            {
              "description": "Fixed data used by the system that is not changed by the represented dataflow, such as configuration, constants, schemas, or static lookup data. Dataflow relationships may leave this node but may not enter it.",
              "const": "static-data"
            },
            {
              "description": "Processing or an algorithm needed to explain how data moves through the flow. Dataflow relationships may enter and leave this node.",
              "const": "data-processing"
            }
          ]
        },
        "name": {
          "description": "Unique name of the node within the document; relationships use this value as the node identifier.",
          "type": "string",
          "minLength": 1
        },
        "journeySequenceId": {
          "description": "Positive sequence number labeling the phase of the user journey that this node implements. Match the containing subgraph's journeySequenceId.",
          "type": "integer",
          "minimum": 1
        },
        "description": {
          "description": "What the node represents and the responsibility it has in the dataflow. For data-processing nodes, a short natural-language summary of the algorithm.",
          "type": "string",
          "minLength": 1
        },
        "medium": {
          "description": "The concrete medium through which the node exists or operates, such as a UI, database, file, browser storage, or external service. For data processing, this is the programming language",
          "type": "string",
          "minLength": 1
        },
        "location": {
          "description": "The concrete system location, such as a UI component name, storage location, or external service URI. For data-processing nodes, include the class name and method name for class-based methods, or the module name and function name for functions outside a class. Do not use a source-code file or line location.",
          "type": "string",
          "minLength": 1
        },
        "changeType": {
          "description": "How the node changes relative to the comparison baseline.",
          "enum": [
            "added",
            "modified",
            "deleted",
            "unchanged"
          ]
        },
        "diffHunkIds": {
          "description": "Diff hunks that establish this changed node's behavior.",
          "type": "array",
          "minItems": 1,
          "uniqueItems": true,
          "items": {
            "type": "string",
            "minLength": 1
          }
        },
        "pseudo-code": {
          "description": "Python-like pseudocode describing the algorithm's steps. Use line breaks, blank lines between logical sections, and four-space indentation for nested blocks; source code belongs in referenced diff hunks for changed nodes.",
          "type": "string",
          "minLength": 1
        }
      },
      "allOf": [
        {
          "if": {
            "properties": {
              "type": {
                "const": "data-processing"
              }
            },
            "required": [
              "type"
            ]
          },
          "then": {
            "required": [
              "pseudo-code"
            ]
          },
          "else": {
            "not": {
              "required": [
                "pseudo-code"
              ]
            }
          }
        }
      ]
    },
    "relationship": {
      "description": "A directed flow of data between two nodes.",
      "type": "object",
      "additionalProperties": false,
      "required": [
        "id",
        "from",
        "to",
        "type",
        "data",
        "purpose"
      ],
      "properties": {
        "id": {
          "description": "Unique identifier for the relationship within the document.",
          "type": "string",
          "minLength": 1
        },
        "from": {
          "description": "Name of the node that supplies the data.",
          "type": "string",
          "minLength": 1
        },
        "to": {
          "description": "Name of the node that receives the data.",
          "type": "string",
          "minLength": 1
        },
        "type": {
          "description": "Kind of relationship between the nodes.",
          "const": "dataflow"
        },
        "changeType": {
          "description": "How the relationship changes relative to the comparison baseline.",
          "enum": [
            "added",
            "modified",
            "deleted",
            "unchanged"
          ]
        },
        "diffHunkIds": {
          "description": "Diff hunks that show this changed data transfer.",
          "type": "array",
          "minItems": 1,
          "uniqueItems": true,
          "items": {
            "type": "string",
            "minLength": 1
          }
        },
        "data": {
          "description": "The description of the data transferred between the nodes, including a short name and the shape of the data.",
          "type": "string",
          "minLength": 1
        },
        "purpose": {
          "description": "Why this dataflow is needed and what system behavior it enables.",
          "type": "string",
          "minLength": 1
        }
      }
    }
  }
}
