{
  "schemaVersion": 4,
  "stage": "high-level-design",
  "feature": "Delivery promise estimator",
  "subgraphs": [
    {
      "id": "journey-1",
      "journeySequenceId": 1,
      "name": "Estimate and choose a delivery option",
      "nodes": [
        {
          "type": "user-input",
          "journeySequenceId": 1,
          "name": "Delivery options input",
          "description": "Captures the customer's delivery address and their eventual delivery-option selection.",
          "medium": "React UI",
          "location": "DeliveryOptionsPanel",
          "changeType": "added"
        },
        {
          "type": "user-output",
          "journeySequenceId": 1,
          "name": "Delivery options display",
          "description": "Presents priced delivery promises and the current selection to the customer.",
          "medium": "React UI",
          "location": "DeliveryOptionsPanel",
          "changeType": "added"
        },
        {
          "type": "system-input",
          "journeySequenceId": 1,
          "name": "Checkout quote request",
          "description": "Starts delivery estimation with the cart and checkout context supplied by the checkout workflow.",
          "medium": "Application command",
          "location": "CheckoutOrchestrator.requestDeliveryQuote",
          "changeType": "added"
        },
        {
          "type": "system-output",
          "journeySequenceId": 1,
          "name": "Selected delivery promise",
          "description": "Returns the customer's final delivery choice to the checkout workflow for order placement.",
          "medium": "Application event",
          "location": "CheckoutOrchestrator.acceptDeliveryPromise",
          "changeType": "added"
        },
        {
          "type": "system-state-read",
          "journeySequenceId": 1,
          "name": "Shopping cart",
          "description": "Reads the products and quantities that must be fulfilled together with the dimensions and weight needed for shipping.",
          "medium": "PostgreSQL",
          "location": "shopping_carts and cart_items tables",
          "changeType": "unchanged"
        },
        {
          "type": "system-state-read",
          "journeySequenceId": 1,
          "name": "Warehouse inventory",
          "description": "Reads available-to-promise quantities by product and fulfillment center.",
          "medium": "PostgreSQL",
          "location": "warehouse_inventory table",
          "changeType": "unchanged"
        },
        {
          "type": "static-data",
          "journeySequenceId": 1,
          "name": "Fulfillment policy",
          "description": "Defines eligible fulfillment centers, handling times, carrier restrictions, split-shipment penalties, and the allowed delivery window.",
          "medium": "Source-controlled YAML",
          "location": "FulfillmentPolicy catalog",
          "changeType": "modified"
        },
        {
          "type": "external-dependency",
          "journeySequenceId": 1,
          "name": "Address validation service",
          "description": "Normalizes the entered address and returns its deliverability, geographic coordinates, and postal region.",
          "medium": "HTTPS API",
          "location": "Address Validation API /v1/validate",
          "changeType": "unchanged"
        },
        {
          "type": "external-dependency",
          "journeySequenceId": 1,
          "name": "Carrier rates service",
          "description": "Returns shipping prices, service levels, and estimated transit times for proposed packages and routes.",
          "medium": "HTTPS API",
          "location": "Carrier Rates API /v2/rates",
          "changeType": "unchanged"
        },
        {
          "type": "data-processing",
          "journeySequenceId": 1,
          "name": "Build candidate fulfillment plans",
          "description": "Constructs feasible ways to allocate the cart across fulfillment centers and package the allocated items.",
          "medium": "TypeScript",
          "location": "DeliveryPlanner.buildCandidatePlans",
          "changeType": "added",
          "pseudo-code": "plans = [empty_plan]\nfor item in cart:\n    eligible_centers = centers_with_inventory_and_service(item, destination)\n    plans = extend_plans(plans, item, eligible_centers)\n    plans = prune_infeasible_plans(plans, max_shipments, remaining_items)\n\nfor plan in plans:\n    plan.packages = package_items(plan, weight_limits, dimension_limits)\n\nreturn deduplicate(plans, by=(\"center\", \"item\", \"package\"))"
        },
        {
          "type": "data-processing",
          "journeySequenceId": 1,
          "name": "Rank delivery options",
          "description": "Combines candidate plans with carrier quotes and selects a small set of meaningful delivery choices.",
          "medium": "TypeScript",
          "location": "DeliveryPlanner.rankOptions",
          "changeType": "added",
          "pseudo-code": "options = []\nfor plan in plans_with_carrier_quotes:\n    price = sum(quote.price for quote in plan.quotes)\n    promised_date = latest_handling_plus_transit(plan)\n    if promised_date not in delivery_window:\n        continue\n    options.append((plan, price, promised_date))\n\noptions = remove_dominated(options, cheaper_and_no_slower=True)\nfor option in options:\n    option.score = score(option, split_shipment_penalty, delivery_risk_buffer)\n\nreturn select_cheapest_fastest_and_best(options, tie_break=(\"date\", \"plan_id\"))"
        },
        {
          "type": "system-state-write",
          "journeySequenceId": 1,
          "name": "Delivery quote session write",
          "description": "Retains the ranked options, their expiration time, and the customer's selected option for the active checkout.",
          "medium": "Redis JSON document",
          "location": "delivery-quotes:{cartId}",
          "changeType": "added"
        },
        {
          "type": "system-state-read",
          "journeySequenceId": 1,
          "name": "Delivery quote session read",
          "description": "Reads the active delivery options and the customer's selection for display and checkout.",
          "medium": "Redis JSON document",
          "location": "delivery-quotes:{cartId}",
          "changeType": "added"
        }
      ],
      "relationships": [
        {
          "id": "relationship-1",
          "from": "Delivery options input",
          "to": "Address validation service",
          "type": "dataflow",
          "changeType": "added",
          "data": "The street address, locality, postal code, and country entered by the customer.",
          "purpose": "Obtains a normalized, deliverable destination before fulfillment work begins."
        },
        {
          "id": "relationship-2",
          "from": "Address validation service",
          "to": "Build candidate fulfillment plans",
          "type": "dataflow",
          "changeType": "added",
          "data": "The normalized address, deliverability result, coordinates, and postal region.",
          "purpose": "Supplies the destination used to filter fulfillment centers and construct carrier routes."
        },
        {
          "id": "relationship-3",
          "from": "Shopping cart",
          "to": "Build candidate fulfillment plans",
          "type": "dataflow",
          "changeType": "added",
          "data": "Cart lines containing product ID, quantity, unit weight, and package dimensions.",
          "purpose": "Defines the items every candidate plan must allocate and package completely."
        },
        {
          "id": "relationship-4",
          "from": "Warehouse inventory",
          "to": "Build candidate fulfillment plans",
          "type": "dataflow",
          "changeType": "added",
          "data": "Available-to-promise quantities for the cart's products, grouped by fulfillment center.",
          "purpose": "Prevents the planner from proposing allocations that a warehouse cannot fulfill."
        },
        {
          "id": "relationship-5",
          "from": "Fulfillment policy",
          "to": "Build candidate fulfillment plans",
          "type": "dataflow",
          "changeType": "modified",
          "data": "Center eligibility, packaging constraints, carrier restrictions, and the maximum shipment count.",
          "purpose": "Constrains the search to operationally valid fulfillment plans."
        },
        {
          "id": "relationship-6",
          "from": "Build candidate fulfillment plans",
          "to": "Carrier rates service",
          "type": "dataflow",
          "changeType": "added",
          "data": "Candidate packages with origin, destination, dimensions, weight, and permitted carrier services.",
          "purpose": "Requests comparable prices and transit estimates for every feasible shipment leg."
        },
        {
          "id": "relationship-7",
          "from": "Build candidate fulfillment plans",
          "to": "Rank delivery options",
          "type": "dataflow",
          "changeType": "added",
          "data": "Candidate plan IDs with their warehouse allocations, packages, and handling times.",
          "purpose": "Provides the plan structure needed to combine carrier quotes and calculate complete delivery promises."
        },
        {
          "id": "relationship-8",
          "from": "Carrier rates service",
          "to": "Rank delivery options",
          "type": "dataflow",
          "changeType": "added",
          "data": "Per-package carrier quotes containing service level, price, transit time, and quote expiration.",
          "purpose": "Supplies the external cost and timing information used to compare candidate plans."
        },
        {
          "id": "relationship-9",
          "from": "Fulfillment policy",
          "to": "Rank delivery options",
          "type": "dataflow",
          "changeType": "modified",